"序号","网址","发帖大类","发帖小类","发帖标题","发帖内容","发帖人","发帖日期","发帖类型","分词结果"
90,http://bbs.cehome.com/thread-1150783-1-1.html,挖掘机专区,我爱我挖,在国外工作的甲友进来说说,请问各位甲友分享一下在国外工作的单位，职业，薪酬，环境，心声！最好能附上照片,zfk37351144,2017-11-28,,在 国外 工作 的 甲友 进 来说说 请问 各位甲友 分享一下 在 国外 工作 的 单 位 ， 职业 ， 薪 酬 ， 环境 ， 心 声 ！ 最好 能 附 上 照片
91,http://bbs.cehome.com/thread-1150742-1-1.html,,,,,,,, 
92,http://bbs.cehome.com/thread-1150735-1-1.html,挖掘机专区,我爱我挖,早 早 早,早起的鸟儿有虫吃，早起的虫儿被鸟吃,拳能帝,2017-11-28,,早   早   早 早起 的 鸟 儿 有 虫 吃 ， 早起 的 虫 儿 被 鸟 吃
93,http://bbs.cehome.com/thread-1150712-1-1.html,挖掘机专区,我爱我挖,【一起来就现在】一起来堵车,,时光-峰,2017-11-28,,【 一起 来就 现在 】 一 起来 堵 车 
94,http://bbs.cehome.com/thread-1150702-1-1.html,我与工程机械,装载机,冲劲都没了,,春夏秋冬.唯我山工,2017-11-28,,冲 劲 都没 了 
95,http://bbs.cehome.com/thread-1150682-1-1.html,我与工程机械,故障咨询,卡特200B旋转泵压盘有多少条弹王,卡特200B旋转泵压盘有多少条弹王求大神指点,15014463467,2017-11-28,,卡特 200B 旋转 泵压 盘 有多少 条 弹 王 卡特 200B 旋转 泵压 盘 有多少 条 弹 王 求 大神指点
96,http://bbs.cehome.com/thread-1150667-1-1.html,我与工程机械,装载机,天冷了。注意保暖。,来烤火了,心中的太阳wang,2017-11-28,,天冷 了 。 注意 保 暖 。 来 烤 火 了
97,http://bbs.cehome.com/thread-1150662-1-1.html,挖掘机专区,我爱我挖,车标,这是什么意思？算领取了么？什么时候发？地址不用么？,情不知何起,2017-11-28,,车标 这是 什么意思 ？ 算 领 取 了 么 ？ 什么时候 发 ？ 地址 不用 么 ？
98,http://bbs.cehome.com/thread-1150657-1-1.html,挖掘机专区,杂谈图库,晚上好,来签到了，大家好啊！！！,飞仙,2017-11-28,,晚上好 来 签到 了 ， 大家 好啊 ！ ！ ！
99,http://bbs.cehome.com/thread-1150649-1-1.html,挖掘机专区,我爱我挖,D4D发动机,求沃尔沃D4D发动机单体泵安装方法,13984214122,2017-11-28,,D4D 发动机 求 沃尔沃 D4D 发动机 单 体 泵 安装 方法
100,http://bbs.cehome.com/thread-1150647-1-1.html,挖掘机专区,我爱我挖,五个甲友喊声到,,手机用户gl12347,2017-11-28,,五个 甲友 喊 声 到 
